{
  "id": "tuhfat_al_atfal",
  "version": 1,
  "title_ar": "تحفة الأطفال",
  "title_en": "Tuhfat al-Atfal",
  "author_ar": "سليمان بن إبراهيم الجمزوري",
  "edition": "Wikisource revision 594187 (normalized harakat)",
  "harakat_policy": "full",
  "source_url": "https://ar.wikisource.org/wiki/تحفة_الأطفال",
  "sections": [
    {
      "id": "intro",
      "title_ar": "المقدمة",
      "lines": [
        {
          "id": "intro_l001",
          "text_ar": "يَقُولُ رَاجِي رَحْمَةِ الْغَفُورِ",
          "words": [
            "يَقُولُ",
            "رَاجِي",
            "رَحْمَةِ",
            "الْغَفُورِ"
          ]
        },
        {
          "id": "intro_l002",
          "text_ar": "دَوْمًا سُلَيْمَانُ هُوَ الْجَمْزُورِي",
          "words": [
            "دَوْمًا",
            "سُلَيْمَانُ",
            "هُوَ",
            "الْجَمْزُورِي"
          ]
        },
        {
          "id": "intro_l003",
          "text_ar": "الْحَمْدُ لِلَّهِ مُصَلِّيًا عَلَى",
          "words": [
            "الْحَمْدُ",
            "لِلَّهِ",
            "مُصَلِّيًا",
            "عَلَى"
          ]
        },
        {
          "id": "intro_l004",
          "text_ar": "مُحَمَّدٍ وَآلِهِ وَمَنْ تَلَا",
          "words": [
            "مُحَمَّدٍ",
            "وَآلِهِ",
            "وَمَنْ",
            "تَلَا"
          ]
        },
        {
          "id": "intro_l005",
          "text_ar": "وَبَعْدُ هَذَا النَّظْمُ لِلْمُرِيدِ",
          "words": [
            "وَبَعْدُ",
            "هَذَا",
            "النَّظْمُ",
            "لِلْمُرِيدِ"
          ]
        },
        {
          "id": "intro_l006",
          "text_ar": "فِي النُّونِ وَالتَّنْوِينِ وَالْمُدُودِ",
          "words": [
            "فِي",
            "النُّونِ",
            "وَالتَّنْوِينِ",
            "وَالْمُدُودِ"
          ]
        },
        {
          "id": "intro_l007",
          "text_ar": "سَمَّيْتُهُ بِتُحْفَةِ الْأَطْفَالِ",
          "words": [
            "سَمَّيْتُهُ",
            "بِتُحْفَةِ",
            "الْأَطْفَالِ"
          ]
        },
        {
          "id": "intro_l008",
          "text_ar": "عَنْ شَيْخِنَا الْمِيهِيِّ ذِي الْكَمَالِ",
          "words": [
            "عَنْ",
            "شَيْخِنَا",
            "الْمِيهِيِّ",
            "ذِي",
            "الْكَمَالِ"
          ]
        },
        {
          "id": "intro_l009",
          "text_ar": "أَرْجُو بِهِ أَنْ يَنْفَعَ الطُّلَّابَا",
          "words": [
            "أَرْجُو",
            "بِهِ",
            "أَنْ",
            "يَنْفَعَ",
            "الطُّلَّابَا"
          ]
        },
        {
          "id": "intro_l010",
          "text_ar": "وَالْأَجْرَ وَالْقَبُولَ وَالثَّوَابَا",
          "words": [
            "وَالْأَجْرَ",
            "وَالْقَبُولَ",
            "وَالثَّوَابَا"
          ]
        }
      ]
    },
    {
      "id": "noon",
      "title_ar": "النون الساكنة والتنوين",
      "lines": [
        {
          "id": "noon_l001",
          "text_ar": "لِلنُّونِ إِنْ تَسْكُنْ وَلِلتَّنْوِينِ",
          "words": [
            "لِلنُّونِ",
            "إِنْ",
            "تَسْكُنْ",
            "وَلِلتَّنْوِينِ"
          ]
        },
        {
          "id": "noon_l002",
          "text_ar": "أَرْبَعُ أَحْكَامٍ فَخُذْ تَبْيِينِي",
          "words": [
            "أَرْبَعُ",
            "أَحْكَامٍ",
            "فَخُذْ",
            "تَبْيِينِي"
          ]
        },
        {
          "id": "noon_l003",
          "text_ar": "فَالْأَوَّلُ الْإِظْهَارُ قَبْلَ أَحْرُفِ",
          "words": [
            "فَالْأَوَّلُ",
            "الْإِظْهَارُ",
            "قَبْلَ",
            "أَحْرُفِ"
          ]
        },
        {
          "id": "noon_l004",
          "text_ar": "لِلْحَلْقِ سِتٍّ رُتِّبَتْ فَلْتَعْرِفِ",
          "words": [
            "لِلْحَلْقِ",
            "سِتٍّ",
            "رُتِّبَتْ",
            "فَلْتَعْرِفِ"
          ]
        },
        {
          "id": "noon_l005",
          "text_ar": "هَمْزٌ فَهَاءٌ ثُمَّ عَيْنٌ حَاءُ",
          "words": [
            "هَمْزٌ",
            "فَهَاءٌ",
            "ثُمَّ",
            "عَيْنٌ",
            "حَاءُ"
          ]
        },
        {
          "id": "noon_l006",
          "text_ar": "مُهْمَلَتَانِ ثُمَّ غَيْنٌ خَاءُ",
          "words": [
            "مُهْمَلَتَانِ",
            "ثُمَّ",
            "غَيْنٌ",
            "خَاءُ"
          ]
        },
        {
          "id": "noon_l007",
          "text_ar": "وَالثَّانِي إِدْغَامٌ بِسِتَّةٍ أَتَتْ",
          "words": [
            "وَالثَّانِي",
            "إِدْغَامٌ",
            "بِسِتَّةٍ",
            "أَتَتْ"
          ]
        },
        {
          "id": "noon_l008",
          "text_ar": "فِي يَرْمَلُونَ عِنْدَهُمْ قَدْ ثَبَتَتْ",
          "words": [
            "فِي",
            "يَرْمَلُونَ",
            "عِنْدَهُمْ",
            "قَدْ",
            "ثَبَتَتْ"
          ]
        },
        {
          "id": "noon_l009",
          "text_ar": "لَكِنَّهَا قِسْمَانِ قِسْمٌ يُدْغَمَا",
          "words": [
            "لَكِنَّهَا",
            "قِسْمَانِ",
            "قِسْمٌ",
            "يُدْغَمَا"
          ]
        },
        {
          "id": "noon_l010",
          "text_ar": "فِيهِ بِغُنَّةٍ بِيَنْمُو عُلِمَا",
          "words": [
            "فِيهِ",
            "بِغُنَّةٍ",
            "بِيَنْمُو",
            "عُلِمَا"
          ]
        },
        {
          "id": "noon_l011",
          "text_ar": "إِلَّا إِذَا كَانَا بِكَلِمَةٍ فَلَا",
          "words": [
            "إِلَّا",
            "إِذَا",
            "كَانَا",
            "بِكَلِمَةٍ",
            "فَلَا"
          ]
        },
        {
          "id": "noon_l012",
          "text_ar": "تُدْغِمْ كَدُنْيَا ثُمَّ صِنْوَانٍ تَلَا",
          "words": [
            "تُدْغِمْ",
            "كَدُنْيَا",
            "ثُمَّ",
            "صِنْوَانٍ",
            "تَلَا"
          ]
        },
        {
          "id": "noon_l013",
          "text_ar": "وَالثَّانِي إِدْغَامٌ بِغَيْرِ غُنَّةْ",
          "words": [
            "وَالثَّانِي",
            "إِدْغَامٌ",
            "بِغَيْرِ",
            "غُنَّةْ"
          ]
        },
        {
          "id": "noon_l014",
          "text_ar": "فِي لَامٍ وَرَاءٍ ثُمَّ كَرَّرَنَّهْ",
          "words": [
            "فِي",
            "لَامٍ",
            "وَرَاءٍ",
            "ثُمَّ",
            "كَرَّرَنَّهْ"
          ]
        },
        {
          "id": "noon_l015",
          "text_ar": "وَالثَّالِثُ الْإِقْلَابُ عِنْدَ الْبَاءِ",
          "words": [
            "وَالثَّالِثُ",
            "الْإِقْلَابُ",
            "عِنْدَ",
            "الْبَاءِ"
          ]
        },
        {
          "id": "noon_l016",
          "text_ar": "مِيمًا بِغُنَّةٍ مَعَ الْإِخْفَاءِ",
          "words": [
            "مِيمًا",
            "بِغُنَّةٍ",
            "مَعَ",
            "الْإِخْفَاءِ"
          ]
        },
        {
          "id": "noon_l017",
          "text_ar": "وَالرَّابِعُ الْإِخْفَاءُ عِنْدَ الْفَاضِلِ",
          "words": [
            "وَالرَّابِعُ",
            "الْإِخْفَاءُ",
            "عِنْدَ",
            "الْفَاضِلِ"
          ]
        },
        {
          "id": "noon_l018",
          "text_ar": "مِنَ الْحُرُوفِ وَاجِبٌ لِلْفَاضِلِ",
          "words": [
            "مِنَ",
            "الْحُرُوفِ",
            "وَاجِبٌ",
            "لِلْفَاضِلِ"
          ]
        },
        {
          "id": "noon_l019",
          "text_ar": "فِي خَمْسَةٍ مِنْ بَعْدِ عَشْرٍ رَمْزُهَا",
          "words": [
            "فِي",
            "خَمْسَةٍ",
            "مِنْ",
            "بَعْدِ",
            "عَشْرٍ",
            "رَمْزُهَا"
          ]
        },
        {
          "id": "noon_l020",
          "text_ar": "فِي كَلِمِ هَذَا الْبَيْتِ قَدْ ضَمَّنْتُهَا",
          "words": [
            "فِي",
            "كَلِمِ",
            "هَذَا",
            "الْبَيْتِ",
            "قَدْ",
            "ضَمَّنْتُهَا"
          ]
        },
        {
          "id": "noon_l021",
          "text_ar": "صِفْ ذَا ثَنَا كَمْ جَادَ شَخْصٌ قَدْ سَمَّا",
          "words": [
            "صِفْ",
            "ذَا",
            "ثَنَا",
            "كَمْ",
            "جَادَ",
            "شَخْصٌ",
            "قَدْ",
            "سَمَّا"
          ]
        },
        {
          "id": "noon_l022",
          "text_ar": "دُمْ طَيِّبًا زِدْ فِي تُقًى ضَعْ ظَالِمَا",
          "words": [
            "دُمْ",
            "طَيِّبًا",
            "زِدْ",
            "فِي",
            "تُقًى",
            "ضَعْ",
            "ظَالِمَا"
          ]
        }
      ]
    },
    {
      "id": "shadda",
      "title_ar": "الميم والنون المشددتين",
      "lines": [
        {
          "id": "shadda_l001",
          "text_ar": "وَغُنَّ مِيمًا ثُمَّ نُونًا شُدِّدَا",
          "words": [
            "وَغُنَّ",
            "مِيمًا",
            "ثُمَّ",
            "نُونًا",
            "شُدِّدَا"
          ]
        },
        {
          "id": "shadda_l002",
          "text_ar": "وَسَمِّ كُلًّا حَرْفَ غُنَّةٍ بَدَا",
          "words": [
            "وَسَمِّ",
            "كُلًّا",
            "حَرْفَ",
            "غُنَّةٍ",
            "بَدَا"
          ]
        }
      ]
    },
    {
      "id": "meem",
      "title_ar": "الميم الساكنة",
      "lines": [
        {
          "id": "meem_l001",
          "text_ar": "وَالْمِيمُ إِنْ تَسْكُنْ تَجِي قَبْلَ الْهِجَا",
          "words": [
            "وَالْمِيمُ",
            "إِنْ",
            "تَسْكُنْ",
            "تَجِي",
            "قَبْلَ",
            "الْهِجَا"
          ]
        },
        {
          "id": "meem_l002",
          "text_ar": "لَا أَلِفٌ لَيِّنَةٌ لِذِي الْحِجَا",
          "words": [
            "لَا",
            "أَلِفٌ",
            "لَيِّنَةٌ",
            "لِذِي",
            "الْحِجَا"
          ]
        },
        {
          "id": "meem_l003",
          "text_ar": "أَحْكَامُهَا ثَلَاثَةٌ لِمَنْ ضَبَطْ",
          "words": [
            "أَحْكَامُهَا",
            "ثَلَاثَةٌ",
            "لِمَنْ",